{
  "$schema": "./component-policy.schema.json",
  "version": "0.1.0",
  "status": "binding-for-new-ui",
  "instructionEntrypoints": [
    "AGENTS.md",
    "docs/ai-ui-build-directive.md",
    ".github/copilot-instructions.md",
    ".cursor/rules/missa-ui.mdc"
  ],
  "sources": {
    "installed": "@/components/ui",
    "studioLocal": "@/components/shadcn-studio",
    "shadcn": "@shadcn",
    "studioComponents": "@ss-components",
    "studioBlocks": "@ss-blocks",
    "studioPages": "@ss-pages",
    "coss": "selective-review-only"
  },
  "sourcePriority": [
    "installed",
    "shadcn",
    "studioComponents",
    "studioBlocks",
    "studioPages",
    "coss",
    "custom-with-rationale"
  ],
  "typography": {
    "editorial": "Newsreader",
    "interface": "Instrument Sans",
    "data": "Fragment Mono"
  },
  "tokens": {
    "required": true,
    "allowedColorRoles": [
      "canvas",
      "surface",
      "ink",
      "primary",
      "success",
      "warning",
      "destructive",
      "information",
      "border",
      "focus"
    ],
    "forbidFeatureHex": true,
    "forbidFeatureFontFamily": true,
    "forbidArbitraryRadius": true,
    "forbidArbitraryAnimation": true
  },
  "intents": {
    "composition.liquid-glass-welcome": {
      "semantic": "LiquidGlassWelcome",
      "composition": ["Button", "Link", "DecorativeCanvas"],
      "appearance": "white-editorial-with-refractive-forest-scene",
      "boundary": "Optional /welcome entry; finite gesture-driven artwork; real /onboarding and /opportunities links; does not alter account onboarding state."
    },
    "composition.reader-operations": {
      "semantic": "ReaderOperations",
      "implementation": "apps/web/components/reader-operations.tsx",
      "composition": ["Progress", "Table", "Tabs", "Sheet", "DropdownMenu", "Popover", "Dialog", "Field", "Input", "Avatar", "Checkbox", "Switch", "Button", "Alert", "Empty", "Sonner", "CountBadge", "CalibrationBadge", "WorkDecisionBadge", "SegmentedChoice", "ListGroup", "DetailFields"],
      "boundary": "One round at a time. Progress and calibration are derived from recorded assignments and scores; distribution previews a deterministic plan with conflict reasons before writing, and the commit applies only the previewed plan. Decisions remain per Work through the existing decision route."
    },
    "composition.submissions-workspace": {
      "semantic": "SubmissionsWorkspace",
      "implementation": "apps/web/components/submissions-workspace.tsx",
      "composition": ["InputGroup", "Select", "Table", "Checkbox", "Sheet", "DropdownMenu", "Dialog", "Button", "Empty", "Sonner", "ListGroup", "DetailFields", "PersonAvatar", "DecisionSummaryBadge", "IntakeFlagBadge", "WorkDecisionBadge"],
      "boundary": "The organization's submission list. Filters live in the address and are applied on the server. Sections order rows by the next step; bulk decisions only fill undecided Works after a confirmation, and bulk letters are drafts that still pass approval. Receipt, review and decision stay separate facts."
    },
    "composition.organization-settings": {
      "semantic": "OrganizationSettingsPage",
      "implementation": "apps/web/app/organization/[organizationId]/settings/page.tsx",
      "composition": ["Button", "Select", "SettingsStateBadge", "Alert", "Empty", "SettingsRow", "DetailFields", "HueTile", "OrganizationCustomizationForm"],
      "boundary": "One section at a time, chosen from a list of links (a Select on a phone). Read-only and not-yet-built sections say so with a badge; no commercial, security or destructive control is offered."
    },
    "composition.communications-manager": {
      "semantic": "CommunicationsManager",
      "implementation": "apps/web/components/communications-manager.tsx",
      "composition": ["Table", "Sheet", "Select", "DropdownMenu", "Field", "Input", "Textarea", "Checkbox", "Avatar", "Button", "Dialog", "Tabs", "Alert", "Empty", "Sonner", "ListGroup", "DetailFields", "HueTile", "PersonAvatar", "DatePickerField", "LetterStateBadge"],
      "boundary": "Letters are organization words sent through Missa. A batch is sent only after approval bound to its wording; a test send goes to the admin only; per-recipient results come from the durable mail ledger and are never inferred."
    },
    "composition.edit-submission": {
      "semantic": "EditSubmissionDialog",
      "implementation": "apps/web/components/edit-submission-dialog.tsx",
      "composition": ["Dialog", "Field", "Input", "Textarea", "Button", "Alert", "Sonner"],
      "boundary": "A submitter changes Work titles, Work files and text or file answers only while the call is open, no reader is assigned and no decision exists, unless the organization locked the opportunity. Files must be the submitter's own Missa uploads; every change is recorded and shown in the organization's history."
    },
    "composition.round-rubric": {
      "semantic": "RubricDialog",
      "implementation": "apps/web/components/reader-round-actions.tsx",
      "composition": ["Dialog", "Field", "Input", "Textarea", "SegmentedChoice", "Button", "Alert", "Sonner"],
      "boundary": "Each save creates an immutable rubric version; reads already scored keep their version. Readers score whole numbers per criterion in the reviewer score form, and the server computes the weighted 0 to 100 score used for ranking and calibration."
    },
    "composition.submitter-questions": {
      "semantic": "SubmitterQuestions",
      "implementation": "apps/web/components/submitter-questions.tsx",
      "composition": ["Table", "Sheet", "Field", "Textarea", "Button", "Alert", "Empty", "Sonner", "ListGroup", "DetailFields", "PersonAvatar", "QuestionStateBadge"],
      "boundary": "A submitter asks about their own submission from its receipt; the organization answers or closes it from Messages. Answers appear on the receipt and are emailed; who answered is never shown to the submitter."
    },
    "composition.organization-customization": {
      "semantic": "OrganizationCustomizationForm",
      "implementation": "apps/web/components/organization-customization-form.tsx",
      "composition": ["SettingsRow", "Field", "Input", "RadioGroup", "SegmentedChoice", "Checkbox", "Switch", "DropdownMenu", "Button", "Alert", "Sonner", "OrganizationMark"],
      "boundary": "Accent choices are names for existing palette mappings in components/design-system/organization-palette.css; no raw colour is accepted or stored. Stage labels and transparency change wording and visibility only, never the recorded facts."
    },
    "composition.submission-receipt": {
      "semantic": "SubmissionReceipt",
      "implementation": "apps/web/app/(passport)/tracker/submissions/[submissionId]/page.tsx",
      "composition": ["Button", "AlertDialog", "DetailFields", "HueTile", "WorkDecisionBadge", "SubmissionStatusTimeline", "SubmitterQuestions", "EditSubmissionDialog"],
      "boundary": "The submitter's own record of one hosted submission: where it stands, each Work with its own recorded decision, their answers, questions, history and payment. Withdrawal is confirmed in an AlertDialog. No reader, score or note is ever shown."
    },
    "composition.submission-status-timeline": {
      "semantic": "SubmissionStatusTimeline",
      "implementation": "apps/web/components/submission-status-timeline.tsx",
      "composition": ["SubmissionStageBadge"],
      "boundary": "Submitter-facing journey derived from receipt, sent stage letters and recorded decisions under the organization's transparency setting. Never names readers, scores or notes."
    },
    "composition.admin-publication-review": {
      "semantic": "PlatformAdminPublicationReview",
      "implementation": "apps/web/components/platform-admin-publication-review.tsx",
      "composition": [
        "Button",
        "Field",
        "Input",
        "Textarea",
        "AlertDialog",
        "Alert",
        "Empty",
        "Sonner"
      ],
      "boundary": "Platform-admin decision queue for review-agent holds. Approve publishes through the database publication gates; block suppresses. Hold reasons are plain text, not badges."
    },
    "composition.application-tracker-preview": {
      "semantic": "ApplicationTrackerPreview",
      "composition": ["Button", "Field", "Input", "Textarea", "NativeSelect"],
      "boundary": "Device-local preview; no notification delivery or live calendar sync."
    },
    "composition.application-preparation": {
      "semantic": "ApplicationPreparation",
      "implementation": "apps/web/components/missa/application-preparation.tsx",
      "composition": [
        "Button",
        "Checkbox",
        "Progress",
        "Dialog",
        "Field",
        "Input",
        "NativeSelect",
        "Skeleton"
      ],
      "boundary": "Account-owned canonical applications and preparation; explicit recorded events, no submission on external navigation."
    },
    "input.creator-handle": {
      "semantic": "PortfolioHandleField",
      "composition": ["Input", "Button", "status text"],
      "appearance": "optional-draft-handle-with-availability-and-publish-confirmation"
    },
    "choice.publication-directory": {
      "semantic": "PortfolioPublicationPicker",
      "primitive": "Combobox",
      "appearance": "asynchronous-directory-search-with-manual-name-fallback"
    },
    "choice.creator-theme": {
      "semantic": "ProfileStudio",
      "base": "Button",
      "appearance": "single-pressed-curated-theme-card"
    },
    "composition.creator-profile-editor": {
      "semantic": "ProfileStudio",
      "implementation": "components/creator-profile/studio/profile-studio.tsx",
      "composition": [
        "Button",
        "Input",
        "Textarea",
        "NativeSelect",
        "Switch",
        "Dialog",
        "Combobox",
        "PortfolioLinkPreview",
        "PortfolioHandleField",
        "ProvenanceBadge"
      ],